{
  "actions": [
    {
      "action_id": "prepare-installation-directories",
      "action_type": "filesystem",
      "reason": "Create portable LEOS configuration, state, and log roots.",
      "required": true,
      "status": "planned"
    },
    {
      "action_id": "verify-python-runtime",
      "action_type": "runtime",
      "reason": "The hardware detector is already running on Python.",
      "required": true,
      "status": "satisfied"
    },
    {
      "action_id": "install-container-runtime",
      "action_type": "container-runtime",
      "reason": "LEOS services are deployed as isolated containers.",
      "required": false,
      "status": "satisfied"
    },
    {
      "action_id": "verify-container-service-access",
      "action_type": "container-runtime",
      "reason": "The installer must be able to create and inspect isolated service containers.",
      "required": false,
      "status": "satisfied"
    },
    {
      "action_id": "configure-nvidia-container-runtime",
      "action_type": "gpu-runtime",
      "reason": "NVIDIA-backed profiles require a compatible container runtime integration.",
      "required": false,
      "status": "satisfied"
    },
    {
      "action_id": "write-installation-profile",
      "action_type": "configuration",
      "reason": "Persist the selected profile and resource budget.",
      "required": true,
      "status": "planned"
    },
    {
      "action_id": "deploy-core-services",
      "action_type": "deployment",
      "reason": "Deploy the governed LEOS core after all blockers are resolved.",
      "required": true,
      "status": "planned"
    },
    {
      "action_id": "run-first-start-doctor",
      "action_type": "verification",
      "reason": "Verify service health, permissions, resource capacity, and configuration after deployment.",
      "required": true,
      "status": "planned"
    }
  ],
  "compute_node_capacity": {
    "contract_version": "leos.compute-node-capacity.v1",
    "cpu_cores_total": 16,
    "enabled": true,
    "gpus": [
      {
        "enabled": true,
        "memory_mb_total": 12288,
        "name": "NVIDIA RTX 3060",
        "uuid": "GPU-FIXTURE-3060"
      }
    ],
    "labels": {
      "architecture": "x86_64",
      "gpu_mode": "nvidia",
      "installation_profile": "leos-standard-nvidia"
    },
    "max_concurrent_jobs": 7,
    "memory_mb_total": 32768,
    "node_id": "node-example",
    "status": "online"
  },
  "contract_version": "leos.installation-plan.v1",
  "created_at": "2026-07-20T00:00:00+00:00",
  "environment": {
    "LEOS_CONTAINER_RUNTIME": "docker",
    "LEOS_GPU_MODE": "nvidia",
    "LEOS_INSTALL_PROFILE": "leos-standard-nvidia",
    "LEOS_MAX_CONCURRENT_EMPLOYEES": "7"
  },
  "execution": {
    "external_network_contacted": false,
    "mutates_host": false,
    "requires_confirmation": true
  },
  "inventory_id": "inventory-c92bfb1e699725a9",
  "node_id": "node-example",
  "plan_id": "plan-4ae24502f43546e5",
  "readiness": "ready",
  "recommendation_id": "recommendation-d93172d3719721ce",
  "resource_budget": {
    "cpu_cores_reserved": 2,
    "cpu_cores_total": 16,
    "employee_cpu_cores_default": 2,
    "employee_memory_mb_default": 2048,
    "max_concurrent_employees": 7,
    "memory_mb_reserved": 4096,
    "memory_mb_total": 32768
  },
  "selected_profile": "leos-standard-nvidia"
}
